{
  "$schema": "https://json-schema.org/draft/2020-12/schema",
  "title": "Git Health Monitor advisory AI review v1",
  "type": "object",
  "additionalProperties": false,
  "required": ["riskSummary", "evidence", "reviewChecklist", "refactorSuggestions", "limitations"],
  "properties": {
    "riskSummary": {"type": "string", "minLength": 1, "maxLength": 1200},
    "evidence": {"type": "array", "minItems": 1, "maxItems": 10, "items": {
      "type": "object", "additionalProperties": false, "required": ["evidenceId", "explanation"],
      "properties": {"evidenceId": {"type": "string", "pattern": "^E[0-9]{1,3}$"}, "explanation": {"type": "string", "minLength": 1, "maxLength": 600}}
    }},
    "reviewChecklist": {"type": "array", "minItems": 1, "maxItems": 5, "items": {"$ref": "#/$defs/advice"}},
    "refactorSuggestions": {"type": "array", "maxItems": 3, "items": {"$ref": "#/$defs/advice"}},
    "limitations": {"type": "array", "minItems": 1, "maxItems": 5, "items": {"type": "string", "minLength": 1, "maxLength": 400}}
  },
  "$defs": {
    "advice": {"type": "object", "additionalProperties": false, "required": ["text", "evidenceIds"],
      "properties": {"text": {"type": "string", "minLength": 1, "maxLength": 600}, "evidenceIds": {"type": "array", "minItems": 1, "maxItems": 10, "uniqueItems": true, "items": {"type": "string", "pattern": "^E[0-9]{1,3}$"}}}
    }
  }
}
